{
    "test_timestamp": "20250403-103501",
    "question_model": "qwen2.5_7B-128k",
    "evaluator_model": "gemma2_9B-8k",
    "rag_parameters": {
        "retrieval_algorithm": "embedding",
        "num_retrieved_docs": 3,
        "chunk_size": 1000,
        "overlap_size": 20
    },
    "overall_metrics": {
        "accuracy": 0.3,
        "precision": 1.0,
        "recall": 0.3,
        "specificity": 0.0,
        "f1_score": 0.4615384615384615,
        "true_positives": 3,
        "true_negatives": 0,
        "false_positives": 0,
        "false_negatives": 7,
        "total_questions": 10,
        "dataset_self_evaluation_success": {
            "table_questions": 0.3
        }
    },
    "overall_duration_seconds": 42.818570137023926,
    "duration_qa_phase_seconds": 37.61288404464722,
    "duration_eval_phase_seconds": 5.205686092376709,
    "per_dataset_details": {
        "table_questions": {
            "results": [
                {
                    "question": "What is the pattern of the type 'mineral'?",
                    "expected_answer": "angular, with sharp angles and edges",
                    "model_answer": "Angular, with sharp angles and edges.",
                    "retrieved_context": "another type of fertiliser, even if the distribution is very similar! You can determine which spreading chart compares the best to the fertiliser you are using based on similar weight. Select the type of fertiliser from the spreading chart that is closest to the type of fertiliser that you are using. The characteristics of the various types of fertiliser are so far reaching that using a spreading chart for another type of fertiliser, even if the distribution is the same, could provide a bad spreading pattern and could harm the crop! 57 ================================================================================ Page 58 ================================================================================ ===Page 58=== To be done before spreading Determine the type of fertiliser based on the shape and surface: Type Operation pattern Surface 0 Granular rough roughly round, sometimes slightly angular, no sharp corners or edges rough 1 smooth roughly round, not angular, no sharp corners or edges relatively smooth 2 mineral angular, with sharp angles and edg- es very rough 3 prills perfectly round, hollow on the in- side, some holes in the surface very smooth 4 Crystalline oblong, cylindrical, some round pat- terns, hollow on the inside, some holes on the surface smooth 5 Blend blend of granules with various pat- terns, different\nhollow on the inside, some holes on the surface smooth 5 Blend blend of granules with various pat- terns, different from above descrip- tions blend of granules with various surfaces, different from above de- scriptions 6 Pellets Pellets of organic material 7 Seed Slug pellets A seed can vary from species to species. A seed can have different charac- teristics. [Image] Granular [Image: Granular] prills Crystalline [Image: Crystalline] Blend [Image: Blend] 58 Pellets Seed Slug pellets [Image: Slug pellets] [Image] mineral [Image: mineral] [Image] ================================================================================ Page 59 ================================================================================ ===Page 59=== Determining distribution [Image] [Image] [Image] [Image] [Image] To be done before spreading The distribution is the ratio of granules with different diameters. A distribution meter comes with every spreader. This meter has 4 sections, with seven parts. The seven have different mesh width that divide the fertiliser granules, based on their diameters. Distribution of 0-70-30-0 indicates none of the granules has a diameter of less than 2.0 mm, 70% have a diameter between 2.0 - 3.3 mm, 30% have a diameter between 3.3 - 4.75 mm and none is larger than 4.75 mm. You should therefore do the following to determine the distribution of the fertiliser with the distribution meter:\ndepends on the characteristics of the fertiliser, not the brand! Determine the characteristics of the fertiliser, therefore, and find the spreading chart with similar features. Use the chart, even if the brand of the fertiliser differs from the nearest comparable fertiliser! Select the spreading chart based on the characteristics of the fertiliser and not on the brand! In order to find the correct spreading chart in the spreading chart book, online spreading chart service on the website, or via the free application (App) on your mobile phones, you must collect the following physical properties of the fertiliser · type and pattern of the granules  see the paragraph below,»Determine the type and pattern of the granules« · distribution (= composition of granules of various sizes),  see paragraph »Determining distribution« on page 59, · similar weight,  See paragraph »Determining similar weight« on page 60. Distribution is the most vital characteristic of the fertiliser when it comes to spreading. You can make the first selection from the (online) spreading charts based on the distribution. Never use a spreading chart for another type of fertiliser, even if the distribution is very similar! You can determine which spreading chart compares the best",
                    "page": 58,
                    "dataset": "table_questions",
                    "qa_error": false,
                    "self_evaluation": "yes",
                    "eval_error": false
                },
                {
                    "question": "What is the hopper weight without hopper cover in kg of the Exacta-TLX GEOSPREAD 3225?",
                    "expected_answer": "337.5 kg",
                    "model_answer": "765",
                    "retrieved_context": ",  Cat. II or Cat. 3 and 4 with intermediate frame   See »Intermediate frame (Cat 3/4)« on page 147,  Cat. II or Cat. 3 and 4 with intermediate frame   See »Intermediate frame (Cat 3/4)« on page 147,  Cat. II or Cat. 3 and 4 with intermediate frame   See »Intermediate frame (Cat 3/4)« on page 147,\n8                          Maximum total weight (kg)                                                                                                4895                                                                                                4895                                                                                                4895                                                                                                4895\n9                                      Hopper weight                                                                                                                                                                                                                                                                                                                                                                                                                \n10                         Without hopper cover (kg)                                                                                               277,5                                                                                               307,5                                                                                               337,5                                                                                               367,5\n11                            With hopper cover (kg)                                                                                               324,5                                                                                               354,5                                                                                               384,5                                                                                               414,5\n12                   With electric hopper cover (kg)                                                                                                                                                                                                     365                                                                                                 395                                                                                                 425\n13                                         Spreading                                                                                                                                                                                                                                                                                                                                                                                                                \n14                                 Working width (m)                                                                   24, 27/28, 30, 32/33, 36, 39, 42*                                                                   24, 27/28, 30, 32/33, 36, 39, 42*                                                                   24, 27/28, 30, 32/33, 36, 39, 42*                                                                   24, 27/28, 30, 32/33, 36, 39, 42*\n15              Fertiliser application rate (kg/min)                                                             10-540 (with slug pellets 0.5-5 kg/min)                                                             10-540 (with slug pellets 0.5-5 kg/min)                                                             10-540 (with slug pellets 0.5-5 kg/min)                                                             10-540 (with slug pellets 0.5-5 kg/min)\n16                                   PTO shaft (rpm)                                                                                           410 - 570                                                                                           410 - 570                                                                                           410 - 570                                                                                           410 - 570\n17                                       Lubrication                                                                                         Lubrication                                                                                         Lubrication                                                                                         Lubrication                                                                                         Lubrication\n18                             Grease for gear boxes                                                                                           EP 00/000                                                                                           EP 00/000                                                                                           EP 00/000                                                                                           EP 00/000\n19         Content of spreading disc gearbox (cm 3 )                                                                                                1500                                                                                                1500                                                                                                1500                                                                                                1500\n20  Content (grease) of the central gearbox  (cm 3 )                                                                                             2 x 250                                                                                             2 x 250                                                                                             2 x 250                                                                                             2 x 250\n* For some working widths, a vane set for large working widths is required.\n See »Set of vanes for large working widths« on page 44\n36\n\n================================================================================\nPage 37\n================================================================================\n\n\n===Page 37===\n\nGetting familiar with the machine\nTechnical specifications\n                                                           0                                                                        1                                                                        2\n0                                       Exacta-TLX GEOSPREAD                                                     Exacta-TLX GEOSPREAD                                                     Exacta-TLX GEOSPREAD\n1                                                Sound level                                                             Closed cabin                                                       Rear window opened\n2                                    Tractor at 540 rpm (dB)                                                                     71.9                                                                     76.2\n3                   Tractor + operating, empty spreader (dB)                                                                     71.9                                                                     82.3\n4                Tractor + spreading spreader (Kali 60) (dB)                                                                     73.8                                                                     84.6\n5  Tractor + spreading spreader (Kali 60) + Ex- actLine (dB)                                                                     73.0                                                                     87.2\n6                                              Miscellaneous                                                            Miscellaneous\nmost of the implement functions used can be operated centrally with one handle. This is available in addition to the ISOBUS terminal such as the IsoMatch. Handle control While working attention and visibility is often required to follow the work process. By locating the control buttons on the handle by touch, it will enable you to keep your eyes on the driving system control and remain focussed while driving. If operating buttons can be located by the sense of touch reaction speed can be increased and operating mistakes avoided. 44 functions under 11 buttons The IsoMatch Grip has 11 function buttons and one selector that are operated with the thumb and under which there are 44 functions. 35 ================================================================================ Page 36 ================================================================================ ===Page 36=== Getting familiar with the machine Technical specifications Exacta-TLX GEOSPREAD 1875 2550 3225 3900 0 General 1 Content of the hopper (l) 1875 2550 3225 3900 2 Filling level (cm) 122 141 160 179 3 Filling width (cm) 284 284 284 284 4 Hopper's width (cm) 290 290 290 290 5 Weight (kg) 705 735 765 795 6 Maximum load capacity (kg) 3900 7 Type of linkage pins Cat. II or Cat. 3 and 4 with intermediate\nof conformity Kverneland Group Nieuw-Vennep BV Hoofdweg 1278 NL-2153 LR Nieuw-Vennep The Netherlands declares fully under own responsibility that the product Exacta-TLX GEOSPREAD weighing spreader with accessories in all models Type: VN407 Valid from series number: VN4070001001 complies with the following applicable EU legislations: · Directive 2006/42/EC · Directive 2014/30/EU The following harmonised standards have been applied: · EN ISO 4254-1 :2015 · EN ISO 4254-8 :2018 Kverneland Group Nieuw-Vennep BV Nieuw-Vennep, 22.06.2021 R.H.F. Harmsen Director and authorised representative* [Image: R.H.F. Harmsen Director and authorised representative*] * Person authorised to compile the technical file and established in the Community. See above for address. Type plate [Image: Type plate] 158 ================================================================================ Page 159 ================================================================================ ===Page 159=== Notes 159 Notes ================================================================================ Page 160 ================================================================================ ===Page 160=== Index A Accessories 0 1 0 cable with plugs for ISO 11786 in cab connection cable with plugs for ISO 11786 in cab connection 1 144 Calibration container 149 2 drain kit 149 3 Electric hopper cover 150 4 ExactLine 148 5 Extended ISO cable 144 6 GEOCONTROL software 145 7 hopper cover 150 8 hopper extensions 150 9 hydraulic border spreading plate 148 10 IM Tellus sensor input 144 11 IsoMatch Eye 146 12 IsoMatch",
                    "page": 36,
                    "dataset": "table_questions",
                    "qa_error": false,
                    "self_evaluation": "no",
                    "eval_error": false
                },
                {
                    "question": "What is the weight in kg of the Exacta-TLX GEOSPREAD 3900?",
                    "expected_answer": "795 kg",
                    "model_answer": "Unknown",
                    "retrieved_context": ",  Cat. II or Cat. 3 and 4 with intermediate frame   See »Intermediate frame (Cat 3/4)« on page 147,  Cat. II or Cat. 3 and 4 with intermediate frame   See »Intermediate frame (Cat 3/4)« on page 147,  Cat. II or Cat. 3 and 4 with intermediate frame   See »Intermediate frame (Cat 3/4)« on page 147,\n8                          Maximum total weight (kg)                                                                                                4895                                                                                                4895                                                                                                4895                                                                                                4895\n9                                      Hopper weight                                                                                                                                                                                                                                                                                                                                                                                                                \n10                         Without hopper cover (kg)                                                                                               277,5                                                                                               307,5                                                                                               337,5                                                                                               367,5\n11                            With hopper cover (kg)                                                                                               324,5                                                                                               354,5                                                                                               384,5                                                                                               414,5\n12                   With electric hopper cover (kg)                                                                                                                                                                                                     365                                                                                                 395                                                                                                 425\n13                                         Spreading                                                                                                                                                                                                                                                                                                                                                                                                                \n14                                 Working width (m)                                                                   24, 27/28, 30, 32/33, 36, 39, 42*                                                                   24, 27/28, 30, 32/33, 36, 39, 42*                                                                   24, 27/28, 30, 32/33, 36, 39, 42*                                                                   24, 27/28, 30, 32/33, 36, 39, 42*\n15              Fertiliser application rate (kg/min)                                                             10-540 (with slug pellets 0.5-5 kg/min)                                                             10-540 (with slug pellets 0.5-5 kg/min)                                                             10-540 (with slug pellets 0.5-5 kg/min)                                                             10-540 (with slug pellets 0.5-5 kg/min)\n16                                   PTO shaft (rpm)                                                                                           410 - 570                                                                                           410 - 570                                                                                           410 - 570                                                                                           410 - 570\n17                                       Lubrication                                                                                         Lubrication                                                                                         Lubrication                                                                                         Lubrication                                                                                         Lubrication\n18                             Grease for gear boxes                                                                                           EP 00/000                                                                                           EP 00/000                                                                                           EP 00/000                                                                                           EP 00/000\n19         Content of spreading disc gearbox (cm 3 )                                                                                                1500                                                                                                1500                                                                                                1500                                                                                                1500\n20  Content (grease) of the central gearbox  (cm 3 )                                                                                             2 x 250                                                                                             2 x 250                                                                                             2 x 250                                                                                             2 x 250\n* For some working widths, a vane set for large working widths is required.\n See »Set of vanes for large working widths« on page 44\n36\n\n================================================================================\nPage 37\n================================================================================\n\n\n===Page 37===\n\nGetting familiar with the machine\nTechnical specifications\n                                                           0                                                                        1                                                                        2\n0                                       Exacta-TLX GEOSPREAD                                                     Exacta-TLX GEOSPREAD                                                     Exacta-TLX GEOSPREAD\n1                                                Sound level                                                             Closed cabin                                                       Rear window opened\n2                                    Tractor at 540 rpm (dB)                                                                     71.9                                                                     76.2\n3                   Tractor + operating, empty spreader (dB)                                                                     71.9                                                                     82.3\n4                Tractor + spreading spreader (Kali 60) (dB)                                                                     73.8                                                                     84.6\n5  Tractor + spreading spreader (Kali 60) + Ex- actLine (dB)                                                                     73.0                                                                     87.2\n6                                              Miscellaneous                                                            Miscellaneous\npellets 0.5-5 kg/min) 10-540 (with slug pellets 0.5-5 kg/min) 16 PTO shaft (rpm) 410 - 570 410 - 570 410 - 570 410 - 570 17 Lubrication Lubrication Lubrication Lubrication Lubrication 18 Grease for gear boxes EP 00/000 EP 00/000 EP 00/000 EP 00/000 19 Content of spreading disc gearbox (cm 3 ) 1500 1500 1500 1500 20 Content (grease) of the central gearbox (cm 3 ) 2 x 250 2 x 250 2 x 250 2 x 250 * For some working widths, a vane set for large working widths is required.  See »Set of vanes for large working widths« on page 44 36 ================================================================================ Page 37 ================================================================================ ===Page 37=== Getting familiar with the machine Technical specifications 0 1 2 0 Exacta-TLX GEOSPREAD Exacta-TLX GEOSPREAD Exacta-TLX GEOSPREAD 1 Sound level Closed cabin Rear window opened 2 Tractor at 540 rpm (dB) 71.9 76.2 3 Tractor + operating, empty spreader (dB) 71.9 82.3 4 Tractor + spreading spreader (Kali 60) (dB) 73.8 84.6 5 Tractor + spreading spreader (Kali 60) + Ex- actLine (dB) 73.0 87.2 6 Miscellaneous Miscellaneous Miscellaneous 7 Tractor power (kW) 8 Electrical supplies required 1 power socket (ISObus) control box 1 trailer socket for the\nof conformity Kverneland Group Nieuw-Vennep BV Hoofdweg 1278 NL-2153 LR Nieuw-Vennep The Netherlands declares fully under own responsibility that the product Exacta-TLX GEOSPREAD weighing spreader with accessories in all models Type: VN407 Valid from series number: VN4070001001 complies with the following applicable EU legislations: · Directive 2006/42/EC · Directive 2014/30/EU The following harmonised standards have been applied: · EN ISO 4254-1 :2015 · EN ISO 4254-8 :2018 Kverneland Group Nieuw-Vennep BV Nieuw-Vennep, 22.06.2021 R.H.F. Harmsen Director and authorised representative* [Image: R.H.F. Harmsen Director and authorised representative*] * Person authorised to compile the technical file and established in the Community. See above for address. Type plate [Image: Type plate] 158 ================================================================================ Page 159 ================================================================================ ===Page 159=== Notes 159 Notes ================================================================================ Page 160 ================================================================================ ===Page 160=== Index A Accessories 0 1 0 cable with plugs for ISO 11786 in cab connection cable with plugs for ISO 11786 in cab connection 1 144 Calibration container 149 2 drain kit 149 3 Electric hopper cover 150 4 ExactLine 148 5 Extended ISO cable 144 6 GEOCONTROL software 145 7 hopper cover 150 8 hopper extensions 150 9 hydraulic border spreading plate 148 10 IM Tellus sensor input 144 11 IsoMatch Eye 146 12 IsoMatch",
                    "page": 36,
                    "dataset": "table_questions",
                    "qa_error": false,
                    "self_evaluation": "no",
                    "eval_error": false
                },
                {
                    "question": "What is the sound level in dB of a Tractor + spreading spreader (Kali 60) with its rear window opened?",
                    "expected_answer": "84.6 dB",
                    "model_answer": "84.6 dB",
                    "retrieved_context": "pellets 0.5-5 kg/min) 10-540 (with slug pellets 0.5-5 kg/min) 16 PTO shaft (rpm) 410 - 570 410 - 570 410 - 570 410 - 570 17 Lubrication Lubrication Lubrication Lubrication Lubrication 18 Grease for gear boxes EP 00/000 EP 00/000 EP 00/000 EP 00/000 19 Content of spreading disc gearbox (cm 3 ) 1500 1500 1500 1500 20 Content (grease) of the central gearbox (cm 3 ) 2 x 250 2 x 250 2 x 250 2 x 250 * For some working widths, a vane set for large working widths is required.  See »Set of vanes for large working widths« on page 44 36 ================================================================================ Page 37 ================================================================================ ===Page 37=== Getting familiar with the machine Technical specifications 0 1 2 0 Exacta-TLX GEOSPREAD Exacta-TLX GEOSPREAD Exacta-TLX GEOSPREAD 1 Sound level Closed cabin Rear window opened 2 Tractor at 540 rpm (dB) 71.9 76.2 3 Tractor + operating, empty spreader (dB) 71.9 82.3 4 Tractor + spreading spreader (Kali 60) (dB) 73.8 84.6 5 Tractor + spreading spreader (Kali 60) + Ex- actLine (dB) 73.0 87.2 6 Miscellaneous Miscellaneous Miscellaneous 7 Tractor power (kW) 8 Electrical supplies required 1 power socket (ISObus) control box 1 trailer socket for the\nother troughs 4 metres to the right of the tractor tracks. INDICATION Position the troughs horizontally with a spirit level! 78 ================================================================================ Page 79 ================================================================================ ===Page 79=== [Image] To be done before spreading  Start the tractor again.  Close all the doors and windows in the cabin.  Switch the control box on.  Enter the required application rate.  Enter the working width. It is recommended that an application rate of at least 250 kg/ha is entered with the selected driving speed.  Switch on the left spreading disc.  Switch off the automatic calibration.  Engage the PTO shaft and set the RPM of the spreading discs as given in the relevant spreading chart.  Open the right dosing unit.  Drive over the first trough and stop only after you have driven at least 20 metres past this trough. This is because the spreader distributes roughly even to the back, front and to the side.  Close the dosing unit.  Empty the trough with a funnel into the graduated tubes and record the reading in your notebook. Repeat the above procedure, but disconnect the right spreading disc and switch the dosing unit of the right\nin the troughs.  Place trough 1 in the middle of the tractor tracks. INDICATION Position the troughs horizontally with a spirit level!  Divide the additional 6 buckets on the one side of the track over the actual working width of the spreader. The actual width is twice the size of the effective working width! If you want to spread over a working width of 24 metres, place the buckets at 24/6 metres = 4 metres. [Image] 81 ================================================================================ Page 82 ================================================================================ ===Page 82=== To be done before spreading  Start the tractor again.  Close all the doors and windows in the cabin.  Switch the control box on.  Enter the required application rate.  Key in the new value.  Enter the working width. It is recommended that an application rate of at least 250 kg/ha is entered with the selected driving speed.  Switch off the automatic calibration.  Engage the PTO shaft and set the RPM of the spreading discs as given in the relevant spreading chart.  Drive along the tracks and open the dosing units a few metres before you drive over the first bucket in the middle by pressing the start",
                    "page": 37,
                    "dataset": "table_questions",
                    "qa_error": false,
                    "self_evaluation": "yes",
                    "eval_error": false
                },
                {
                    "question": "How often (in what interval) must the condition of the vanes be inspected?",
                    "expected_answer": "daily",
                    "model_answer": "4 times per year",
                    "retrieved_context": "gear grease EP00/000 gear grease 1 Lubricate with grease Lubricate with oil 1 to 2 times Shell Rodina 2, Castrol GS2 or equivalent MIL-L-2105C, SAE 80W-90 124 ================================================================================ Page 125 ================================================================================ ===Page 125=== Maintenance intervals Maintenance Keep to the checking and maintenance intervals given below to keep the machine in good working order. da il y af te r th e first 10 hou rs we ekly ev ery 1 00 ho urs min. 1 x per ye ar As r eco mme nde d If worn Page 0 Inspection 1 »Checking bolts and nuts« · · 130 2 »Checking the hydraulic system« · · 131 3 Condition of the agitator and the agitator axle · 4 Condition of the vanes · 43 5 »Checking and setting the dosing mechanism« · · 133 6 »Checking and setting the discharge point setting mecha- nism« · · 136 7 »Checking and setting the discharge bushing height« · 8 · 138 9 Lubrication 10 4 grease nipples on the PTO shaft · 126 11 2 grease nipples on both discharge bushings · 126 12 1 grease nipple on all four actuators · 126 13 Applying or adding grease 14 Coupling shafts profiled tubes\nthe spare parts manual.  Secure the wheels with the lock clips. Caster wheels may be placed on the side of the frame. This prevents the crop from being damaged while spreading. The spreader is provided with 12 vanes of equal length and 4 shorter.  Grease the threaded rods of the vanes.  Hook the short vanes into the correct position (see illustration).  Then place the other two vanes into the other positions.  Press the vanes in well and put the lock nut in position.  Place the vanes on the other side in the same manner.  Fasten the lock nuts (50NM) Even wear of the vanes The long vanes are positioned in groups of three. The first vane considered in the direction of rotation of the disc will wear out most quickly. TIP  Exchange the first vane after the fixed vane, and the short vane, over a period of time.  After a subsequent period, exchange the foremost vane at that time with the central vane. As a result, the vanes will wear evenly and the spreading pattern will remain optimal. 43 Short vane Short vane [Image: Short vaneShort vane] ================================================================================ Page 44 ================================================================================\nand shoes. Working in an unsafe manner on the hydraulic system could lead to injury and damage to the machine. In the event of injury, contact your physician immediately! There is also the risk of infection! Before operating the hydraulic system, check all connections and hoses for damage and leakage. Regularly inspect the hydraulic system (hoses, pipes, connections). All hoses, piping and connecting points must be checked regularly, but at least once a year, by an expert for leakages or visible damage! The lifetime of a hose should be 6 years maximum (see the production date on the hoses). Damaged or old parts must be replaced with new ones that comply with the technical specifications of the manufacturer of the machine. Damage to the hydraulic system could lead to injury. 131 ================================================================================ Page 132 ================================================================================ ===Page 132=== Maintenance Inspection criteria Replacing instructions 132 It is not permitted to carry out repairs on hydraulic hoses! Replace hoses if the following is detected during inspection: · damage to the exterior up to the armouring (such as abrasion marks, cuts and tears), · the exterior becoming brittle (tears in the hose), · distortion not normal for the pattern of the hose while under",
                    "page": 125,
                    "dataset": "table_questions",
                    "qa_error": false,
                    "self_evaluation": "no",
                    "eval_error": false
                },
                {
                    "question": "How often (in what interval) must the bushing height be checked and the discharge be set?",
                    "expected_answer": "after the first 10 hours and every 100 hours, but a minimum of once per year",
                    "model_answer": "Every 100 hours or annually.",
                    "retrieved_context": " Unscrew the bolts attaching the discharge bush to the star a few times.  Move the discharge bushing upwards or downwards until the distance to the spreading disc is 1.0 mm. You can also put 1.0 mm thick plates between the discharge bush and the spreading disc and lower the discharge bush onto them.  Turn on the bolts attaching the discharge bushing to the agitator axle star.  Check the height again and adjust it if necessary.  Lower the dosing mechanism by turning the fastening bolt nuts upward. Lower the dosing mechanism until the bayonet ring has moved halfway across the bolts attaching the discharge bushing to the star.  Check the position of the dosing mechanism relative to the agitator axle. The distance between the agitator axle and the sealing ring must be the same on all sides.  See paragraph »Checking and setting the dosing mechanism« on page 133.  Turn on the lock nuts on 4 fastening bolts without moving the dosing mechanism again.  Check that the agitator is not in contact with the bolts attaching the agitator seal ring.  Reattach the dashboard with the three fixing knobs.  Perform the check\nfollowing:  Loosen the 2 bolts of the actuator plate slightly.  Slide the actuator plate until the distance between the inside of the rope and the opening of the discharge bushing is 109 mm.  Re-fasten the 2 bolts without sliding the actuator plate again.  Perform the check on the other side as well.  Secure the dashboard by fastening the 3 fixing knobs. [Image] 137 ================================================================================ Page 138 ================================================================================ ===Page 138=== Maintenance Checking and setting the discharge bushing height [Image] [Image] Spreading disc [Image: Spreading disc] Fixing knobs Dashboard [Image: Fixing knobsDashboard] [Image] 138 Avoid contact with the fertiliser and other material You will most likely get into contact with the fertiliser and other material you may wish to spread while filling, adjusting and testing the spreader. Wear protective clothing and safety gloves, read the safety instructions provided by the supplier and follow their directions. Contact with these materials could cause physical harm. Be careful that nothing gets jammed It is easy for parts to get jammed while adjusting and checking the spreader. Work safely while checking and adjusting: · switching off the electronic control system, · switch the tractor off and remove the key from the\ngear grease EP00/000 gear grease 1 Lubricate with grease Lubricate with oil 1 to 2 times Shell Rodina 2, Castrol GS2 or equivalent MIL-L-2105C, SAE 80W-90 124 ================================================================================ Page 125 ================================================================================ ===Page 125=== Maintenance intervals Maintenance Keep to the checking and maintenance intervals given below to keep the machine in good working order. da il y af te r th e first 10 hou rs we ekly ev ery 1 00 ho urs min. 1 x per ye ar As r eco mme nde d If worn Page 0 Inspection 1 »Checking bolts and nuts« · · 130 2 »Checking the hydraulic system« · · 131 3 Condition of the agitator and the agitator axle · 4 Condition of the vanes · 43 5 »Checking and setting the dosing mechanism« · · 133 6 »Checking and setting the discharge point setting mecha- nism« · · 136 7 »Checking and setting the discharge bushing height« · 8 · 138 9 Lubrication 10 4 grease nipples on the PTO shaft · 126 11 2 grease nipples on both discharge bushings · 126 12 1 grease nipple on all four actuators · 126 13 Applying or adding grease 14 Coupling shafts profiled tubes",
                    "page": 125,
                    "dataset": "table_questions",
                    "qa_error": false,
                    "self_evaluation": "no",
                    "eval_error": false
                },
                {
                    "question": "How often (in what interval) must the agitator seal be replaced?",
                    "expected_answer": "every 100 hours or if worn",
                    "model_answer": "Every season, after every 100 operational hours.",
                    "retrieved_context": "gear grease EP00/000 gear grease 1 Lubricate with grease Lubricate with oil 1 to 2 times Shell Rodina 2, Castrol GS2 or equivalent MIL-L-2105C, SAE 80W-90 124 ================================================================================ Page 125 ================================================================================ ===Page 125=== Maintenance intervals Maintenance Keep to the checking and maintenance intervals given below to keep the machine in good working order. da il y af te r th e first 10 hou rs we ekly ev ery 1 00 ho urs min. 1 x per ye ar As r eco mme nde d If worn Page 0 Inspection 1 »Checking bolts and nuts« · · 130 2 »Checking the hydraulic system« · · 131 3 Condition of the agitator and the agitator axle · 4 Condition of the vanes · 43 5 »Checking and setting the dosing mechanism« · · 133 6 »Checking and setting the discharge point setting mecha- nism« · · 136 7 »Checking and setting the discharge bushing height« · 8 · 138 9 Lubrication 10 4 grease nipples on the PTO shaft · 126 11 2 grease nipples on both discharge bushings · 126 12 1 grease nipple on all four actuators · 126 13 Applying or adding grease 14 Coupling shafts profiled tubes\n Unscrew the bolts attaching the discharge bush to the star a few times.  Move the discharge bushing upwards or downwards until the distance to the spreading disc is 1.0 mm. You can also put 1.0 mm thick plates between the discharge bush and the spreading disc and lower the discharge bush onto them.  Turn on the bolts attaching the discharge bushing to the agitator axle star.  Check the height again and adjust it if necessary.  Lower the dosing mechanism by turning the fastening bolt nuts upward. Lower the dosing mechanism until the bayonet ring has moved halfway across the bolts attaching the discharge bushing to the star.  Check the position of the dosing mechanism relative to the agitator axle. The distance between the agitator axle and the sealing ring must be the same on all sides.  See paragraph »Checking and setting the dosing mechanism« on page 133.  Turn on the lock nuts on 4 fastening bolts without moving the dosing mechanism again.  Check that the agitator is not in contact with the bolts attaching the agitator seal ring.  Reattach the dashboard with the three fixing knobs.  Perform the check\nthe tractor, · wait for all machine parts to come to a standstill before you start with the adjustments, · wear protective clothing, such as safety gloves and shoes, · carefully follow the instructions given. Friction with these materials could cause physical injury. The agitator axle is equipped with a plastic seal to prevent fertiliser granule loss along the agitator axle. The seal must be replaced every season, as well as after every 100 operational hours. Only work on a clean machine with an empty hopper.  Set the fine application handle to the normal dosing setting.  Start the tractor and engage the control box.  Activate the empty hopper function.  Please refer to the software instruction manual  Wait until both actuators are completely extended and the dosing units are completely open.  Place the machine on the ground or on firm supports on a firm, level ground.  Switch the electronic control system and the tractor off, remove the key from the ignition and engage the parking brake of the tractor. ================================================================================ Page 141 ================================================================================ ===Page 141=== [Image] Metal seal ring [Image: Metal seal ring] [Image] Maintenance  Open the sieves with the included attachment and",
                    "page": 125,
                    "dataset": "table_questions",
                    "qa_error": false,
                    "self_evaluation": "no",
                    "eval_error": false
                },
                {
                    "question": "With what torque in Nm must a M18 hexagon steel bolt with a 10.9 quality and with a 0.13 friction be fastened?",
                    "expected_answer": "420 Nm",
                    "model_answer": "420",
                    "retrieved_context": "930 10 M24 210 250 600 710 860 1020 1000 1180 * The friction coefficient of 0.10 applies to oiled sheets, cast iron, hardened surfaces, greased threads, etc. The higher value of 0.13 applies to dry sheets. Torques for bolts and nuts with serrated lower edges 10% extra, such as: · Tensilock (K100) · Whizlock. Exceptions to this table are listed in the parts and/or instruction manual. 129 ================================================================================ Page 130 ================================================================================ ===Page 130=== Maintenance Stainless steel tightening torques Guidelines for torques (in Nm) for self-locking nuts, hexagon bolts and nuts. . Quality.Friction *.Thread Torques.70 (A2).0.10. Torques.70 (A2).0.20. Torques.70 (A2).0.30. Torques.80 (A4).0.10. Torques.80 (A4).0.20. Torques.80 (A4).0.30. 0 M5 3.6 5.7 7 4.8 7.6 9.4 1 M6 6.3 9.9 12.2 8.4 13.2 16.3 2 M8 15.2 24.1 29.9 20.3 32.1 39.9 3 M10 29.9 47.7 59.3 39 63 79 4 M12 51 82 102 68 109 136 5 M14 82 131 163 109 175 217 6 M16 126 204 255 168 272 340 7 M18 176 282 352 235 376 469 8 M20 247 401 501 330 534 669 9 M22 337 551 692 450 735 923 10 M24 426 690 863 568 920 1151 * The friction coefficient of 0.10\n0                 70                 70                 85\n4                        M12                27                32                70                85                105                120                120                145\n5                        M14                42                50               115               135                165                195                195                230\n6                        M16                65                76               175               210                260                300                300                350\n7                        M18                90               110               250               290                350                420                410                490\n8                        M20               125               150               350               420                500                600                580                700\n9                        M22               170               200               470               560                670                800                780                930\n10                       M24               210               250               600               710                860               1020               1000               1180\n* The friction coefficient of 0.10 applies to oiled sheets, cast iron, hardened surfaces, greased threads, etc. The higher value of 0.13 applies to dry sheets.\nTorques for bolts and nuts with serrated lower edges 10% extra, such as:\n· Tensilock (K100)\n· Whizlock.\nExceptions to this table are listed in the parts and/or instruction manual.\n129\n\n================================================================================\nPage 130\n================================================================================\n\n\n===Page 130===\n\nMaintenance\nStainless steel tightening torques\nGuidelines for torques (in Nm) for self-locking nuts, hexagon bolts and nuts.\n.\n   Quality.Friction *.Thread Torques.70 (A2).0.10. Torques.70 (A2).0.20. Torques.70 (A2).0.30. Torques.80 (A4).0.10. Torques.80 (A4).0.20. Torques.80 (A4).0.30.\n0                         M5                   3.6                   5.7                     7                   4.8                   7.6                   9.4\n1                         M6                   6.3                   9.9                  12.2                   8.4                  13.2                  16.3\n2                         M8                  15.2                  24.1                  29.9                  20.3                  32.1                  39.9\n3                        M10                  29.9                  47.7                  59.3                    39                    63                    79\n4                        M12                    51                    82                   102                    68                   109                   136\n5                        M14                    82                   131                   163                   109                   175                   217\n6                        M16                   126                   204                   255                   168                   272                   340\n7                        M18                   176                   282                   352                   235                   376                   469\n8                        M20                   247                   401                   501                   330                   534                   669\n9                        M22                   337                   551                   692                   450                   735                   923\n10                       M24                   426                   690                   863                   568                   920                  1151\n* The friction coefficient of 0.10 applies to oiled sheets, cast iron, hardened surfaces, greased threads, etc. The higher value of\nwith border spreading and when checking the spreading pattern with the tray test. Disconnect one of the connectors from the spreading discs.  Apply a suitable lubricant to the drive axles and connectors. Oiling the connectors will prevent them from corroding and becoming difficult to use. [Image] 128 ================================================================================ Page 129 ================================================================================ ===Page 129=== Steel tightening torques Maintenance Guidelines for torques (in Nm) for self-locking nuts, hexagon bolts and nuts. . Quality.Friction *.Thread Torques.4.6.0,10. Torques.4.6.0,13. Torques.8.8.0,10. Torques.8.8.0,13. Torques.10.9.0,10. Torques.10.9.0,13. Torques.12.9.0,10. Torques.12.9.0,13. 0 M5 1,7 2 5 6 7 8 9 10 1 M6 3 4 9 10 13 15 15 18 2 M8 8 9 21 25 31 36 36 42 3 M10 16 19 40 50 60 70 70 85 4 M12 27 32 70 85 105 120 120 145 5 M14 42 50 115 135 165 195 195 230 6 M16 65 76 175 210 260 300 300 350 7 M18 90 110 250 290 350 420 410 490 8 M20 125 150 350 420 500 600 580 700 9 M22 170 200 470 560 670 800 780 930 10 M24 210 250 600 710 860 1020 1000 1180 * The friction coefficient of 0.10 applies to oiled",
                    "page": 129,
                    "dataset": "table_questions",
                    "qa_error": false,
                    "self_evaluation": "yes",
                    "eval_error": false
                },
                {
                    "question": "With what torque in Nm must a M6 hexagon stainless steel bolt with a 70 (A2) quality and with a 0.2 friction be fastened?",
                    "expected_answer": "9.9 Nm",
                    "model_answer": "13.2 Nm",
                    "retrieved_context": "930 10 M24 210 250 600 710 860 1020 1000 1180 * The friction coefficient of 0.10 applies to oiled sheets, cast iron, hardened surfaces, greased threads, etc. The higher value of 0.13 applies to dry sheets. Torques for bolts and nuts with serrated lower edges 10% extra, such as: · Tensilock (K100) · Whizlock. Exceptions to this table are listed in the parts and/or instruction manual. 129 ================================================================================ Page 130 ================================================================================ ===Page 130=== Maintenance Stainless steel tightening torques Guidelines for torques (in Nm) for self-locking nuts, hexagon bolts and nuts. . Quality.Friction *.Thread Torques.70 (A2).0.10. Torques.70 (A2).0.20. Torques.70 (A2).0.30. Torques.80 (A4).0.10. Torques.80 (A4).0.20. Torques.80 (A4).0.30. 0 M5 3.6 5.7 7 4.8 7.6 9.4 1 M6 6.3 9.9 12.2 8.4 13.2 16.3 2 M8 15.2 24.1 29.9 20.3 32.1 39.9 3 M10 29.9 47.7 59.3 39 63 79 4 M12 51 82 102 68 109 136 5 M14 82 131 163 109 175 217 6 M16 126 204 255 168 272 340 7 M18 176 282 352 235 376 469 8 M20 247 401 501 330 534 669 9 M22 337 551 692 450 735 923 10 M24 426 690 863 568 920 1151 * The friction coefficient of 0.10\n0                 70                 70                 85\n4                        M12                27                32                70                85                105                120                120                145\n5                        M14                42                50               115               135                165                195                195                230\n6                        M16                65                76               175               210                260                300                300                350\n7                        M18                90               110               250               290                350                420                410                490\n8                        M20               125               150               350               420                500                600                580                700\n9                        M22               170               200               470               560                670                800                780                930\n10                       M24               210               250               600               710                860               1020               1000               1180\n* The friction coefficient of 0.10 applies to oiled sheets, cast iron, hardened surfaces, greased threads, etc. The higher value of 0.13 applies to dry sheets.\nTorques for bolts and nuts with serrated lower edges 10% extra, such as:\n· Tensilock (K100)\n· Whizlock.\nExceptions to this table are listed in the parts and/or instruction manual.\n129\n\n================================================================================\nPage 130\n================================================================================\n\n\n===Page 130===\n\nMaintenance\nStainless steel tightening torques\nGuidelines for torques (in Nm) for self-locking nuts, hexagon bolts and nuts.\n.\n   Quality.Friction *.Thread Torques.70 (A2).0.10. Torques.70 (A2).0.20. Torques.70 (A2).0.30. Torques.80 (A4).0.10. Torques.80 (A4).0.20. Torques.80 (A4).0.30.\n0                         M5                   3.6                   5.7                     7                   4.8                   7.6                   9.4\n1                         M6                   6.3                   9.9                  12.2                   8.4                  13.2                  16.3\n2                         M8                  15.2                  24.1                  29.9                  20.3                  32.1                  39.9\n3                        M10                  29.9                  47.7                  59.3                    39                    63                    79\n4                        M12                    51                    82                   102                    68                   109                   136\n5                        M14                    82                   131                   163                   109                   175                   217\n6                        M16                   126                   204                   255                   168                   272                   340\n7                        M18                   176                   282                   352                   235                   376                   469\n8                        M20                   247                   401                   501                   330                   534                   669\n9                        M22                   337                   551                   692                   450                   735                   923\n10                       M24                   426                   690                   863                   568                   920                  1151\n* The friction coefficient of 0.10 applies to oiled sheets, cast iron, hardened surfaces, greased threads, etc. The higher value of\nwith border spreading and when checking the spreading pattern with the tray test. Disconnect one of the connectors from the spreading discs.  Apply a suitable lubricant to the drive axles and connectors. Oiling the connectors will prevent them from corroding and becoming difficult to use. [Image] 128 ================================================================================ Page 129 ================================================================================ ===Page 129=== Steel tightening torques Maintenance Guidelines for torques (in Nm) for self-locking nuts, hexagon bolts and nuts. . Quality.Friction *.Thread Torques.4.6.0,10. Torques.4.6.0,13. Torques.8.8.0,10. Torques.8.8.0,13. Torques.10.9.0,10. Torques.10.9.0,13. Torques.12.9.0,10. Torques.12.9.0,13. 0 M5 1,7 2 5 6 7 8 9 10 1 M6 3 4 9 10 13 15 15 18 2 M8 8 9 21 25 31 36 36 42 3 M10 16 19 40 50 60 70 70 85 4 M12 27 32 70 85 105 120 120 145 5 M14 42 50 115 135 165 195 195 230 6 M16 65 76 175 210 260 300 300 350 7 M18 90 110 250 290 350 420 410 490 8 M20 125 150 350 420 500 600 580 700 9 M22 170 200 470 560 670 800 780 930 10 M24 210 250 600 710 860 1020 1000 1180 * The friction coefficient of 0.10 applies to oiled",
                    "page": 129,
                    "dataset": "table_questions",
                    "qa_error": false,
                    "self_evaluation": "no",
                    "eval_error": false
                },
                {
                    "question": "What should I do if the flow of the fertiliser is blocked, at what page should I look?",
                    "expected_answer": "Clean the machine well after each use. Replace the agitator if it is worn out. The page is 118",
                    "model_answer": "Unknown or Not found in context",
                    "retrieved_context": "If you see damage to the vanes, spreading disc or discharge bushing, the failure is most likely caused by a hard object. The agitator is probably damaged too. You must first repair the damage or have it repaired before continuing with spreading.\n Place an object, for example a cloth or bag, in the discharge opening of the discharge bushing on the damaged side. . This will prevent you from wasting fertiliser during transport.\n Start the tractor and engage the control box. The dosing units will now close.\n Switch off the control box.\n Take all appropriate measures for road transport.\n See paragraph »Preparing the machine to be transported« on page 93.\nOn the site of a lockable storage depot:\n Empty the hopper without positioning the machine on the ground.\n Open the sieve closure with an attachment, standard supplied with the machine.\nLock the sieve in the open position\nIf you open the sieves, you should lock them to prevent unwanted closing. Accidental closure could lead to serious injury.\n Remove the object that caused the damage.\n Repair the machine or have your dealer do it.\n115\n\n================================================================================\nPage 116\n================================================================================\n\n\n===Page 116===\n\nUse in the field\nstoppage\nINDICATION\nClose the sieve\nLocking the opened sieve\n[Image: Close the sieveLocking the opened sieve]\nSieve clip locked\n[Image: Sieve clip locked]\n116\nIf you have not found any damage, the failure is probably due to stoppage from an encrusted layer of fertiliser.\n Try to reduce the size of the lump or encrusted layer with an object such as a stick, screwdriver or vane.\nIf you open the filters to reduce the lump or encrusted layer from the top side, you should block them to prevent unwanted closing.\nIf you can reduce the lump or encrusted layer in this way:\n Inspect the hopper contents for other lumps and reduce them.\n Fit the vanes and secure them with the lock nut.\n Check the discharge point setting.\n Close the hopper cover.\n Continue spreading.\nIf you have not managed to reduce the lump or encrusted layer because it is out of reach or there is no tool at your disposal:\n Close the hopper cover.\n Follow the working method as described in the previous paragraph »Damage« until emptying the hopper.\n Remove or reduce the lump or encrusted layer.\n If necessary, dry the hopper and the dosing mechanism.\nOpening the sieve clip\n Open the sieve closure with an attachment, standard supplied with the machine.\n Lock the sieve to prevent it from closing accidentally.\n Close the sieves and check the lock.\n Refill the spreader.\n Check the fertiliser for lumps before and after filling.\n Close the hopper cover.\n\n================================================================================\nPage 117\n================================================================================\n\n\n===Page 117===\n\nStoring the machine\n[Image]\n[Image]\n[Image]\nStoring the machine\nAvoid contact with the fertiliser and other material\nIt is easy to come into contact with the materials when putting away the machine. Always wear protective clothing, such as safety gloves, shoes and goggles. Read and adhere to the additional safety instructions and the of the material producer. Contact with the materials could lead to injury. Contact your physician in such an event!\nBe careful that nothing gets jammed\nIt is also easy to get injured while working with the spreader. Work safely with the machine:\n· releasing the pressure from the hydraulic system,\n· switching off the electronic control system,\n· switch the tractor off and remove the key from the ignition,\n· engage the parking brake of the tractor,\n· wait for all machine parts to come to a standstill before you approach it,\n· wear protective clothing, such as safety gloves and shoes,\n· carefully follow the instructions given.\nFriction with these materials could cause physical injury.\nProtect the machine\nFertiliser and other salts have a great influence on the rate of corrosion. Empty the hopper at the end of activities. Protect the machine by always cleaning it after using such material and patch breaks in the paint. Corrosion affects the strength of the construction and the operation of the machine, which could lead to a shortened lifespan. After cleaning, inject the (white) metal parts of the machine with the supplied preserving liquid point for protection against corrosion of the\nmachine, read the instructions before use.\nBe careful while cleaning with high pressure cleaners\nYou can clean the machine\ndosing units will now close.  Switch off the control box.  Take all appropriate measures for road transport.  See paragraph »Preparing the machine to be transported« on page 93. On the site of a lockable storage depot:  Empty the hopper without positioning the machine on the ground.  Open the sieve closure with an attachment, standard supplied with the machine. Lock the sieve in the open position If you open the sieves, you should lock them to prevent unwanted closing. Accidental closure could lead to serious injury.  Remove the object that caused the damage.  Repair the machine or have your dealer do it. 115 ================================================================================ Page 116 ================================================================================ ===Page 116=== Use in the field stoppage INDICATION Close the sieve Locking the opened sieve [Image: Close the sieveLocking the opened sieve] Sieve clip locked [Image: Sieve clip locked] 116 If you have not found any damage, the failure is probably due to stoppage from an encrusted layer of fertiliser.  Try to reduce the size of the lump or encrusted layer with an object such as a stick, screwdriver or vane. If you open the filters to reduce the lump or encrusted layer from the top\n Switch the tractor off and remove the keys from the ignition.\n Engage the parking brake of the tractor.\n Remove remains from the crop, dirt and stones from the machine.\n Fix the hopper cover.\n Take all appropriate measures for road transport.\n See paragraph »Preparing the machine to be transported« on page 93.\n\n================================================================================\nPage 113\n================================================================================\n\n\n===Page 113===\n\nFailure and stoppage\n[Image]\nCauses\nUse in the field\nBe careful that nothing gets jammed\nIt is also easy to get injured while working with the spreader. Work safely with the machine:\n· releasing the pressure from the hydraulic system,\n· switching off the electronic control system,\n· switch the tractor off and remove the key from the ignition,\n· engage the parking brake of the tractor,\n· wait for all machine parts to come to a standstill before you approach it,\n· wear protective clothing, such as safety gloves and shoes,\n· carefully follow the instructions given.\nFriction with these materials could cause physical injury.\nAvoid contact with the fertiliser and other material\nWhile working with the spreader, you might come into contact with fertiliser or other substances that you want to spread. Wear protective clothing and gloves, read the safety instructions provided by the supplier and follow their directions. Contact with these materials could cause physical harm.\nDuring spreading, if you:\n· see that a spreading disc is spreading irregularly or not at all while the dosing units are open,\n· hear a loud noise,\n· become aware that the machine is vibrating seriously,\n· an alarm is shown on the main screen indicating that the PTO shaft is not connected, while it actually is connected,\n· an alarm will appear on the main screen, indicating that the dosing units cannot be closed,\n see the software instruction manual.\nStop spreading immediately! Disconnect the PTO shaft immediately!\n113\n\n================================================================================\nPage 114\n================================================================================\n\n\n===Page 114===\n\nUse in the field\nINDICATION\nWorking method\n114\n[Image]\nINDICATION\nThese failures are probably caused by one of the following:\n· a hard object blocks the agitator,\n· a hard object or a large piece of fertiliser is (partially) blocking the supply from flowing to the agitator,\n· a hard object or a large piece of fertiliser is (partially) blocking fertiliser from flowing through the dosing opening or discharge bushing,\n· crushed and/or damp fertiliser forms an encrusted layer beneath the agitator and blocks the flow through the dosing openings,\n· a lump of damp fertiliser has formed in the discharge bushing and is blocking flow from the discharge bushing opening. This happens especially when the spreader has not been thoroughly cleaned after it was last used.\nMost types of fertiliser attract water and can thereby form large chunks. These chunks can block the spreader or distort the spreading pattern.\n· When working under moist conditions, use a hopper cover that closes well.\n· Do not spread without a hopper cover under moist conditions.\n· Never leave the fertiliser for a long period of time in the spreader. Chunks can also be formed through moisture in the air.\n· Always clean the spreader well after use, including the dosing openings and the discharge bushings.\nHandle with care\nCautiously approach the machine and handle with care. There could be hot or live parts! Contact with these materials could cause physical injury.\nTo find the cause of the failure or stoppage and solve it as far as possible, proceed as follows.\n Disconnect the PTO shaft immediately!\n Switch off the electronic control system.\n Switch the tractor off, remove the key from the ignition and engage the handbrake of the tractor.\nDo not place the machine on the ground. Placing a filled machine on the ground damages the structure!\n\n================================================================================\nPage 115\n================================================================================\n\n\n===Page 115===\n\nDamage\nClose the sieve\n[Image]\n[Image]\n[Image]\nUse in the field\n Examine the spreading discs and the discharge opening to see what the cause of the failure/stoppage is.\n Adapt the discharge point as needed for easier access.\n If you still cannot see the cause, carefully remove the vanes to see better into the discharge opening of the discharge bushing.\n Pass an object such as a screwdriver through the discharge opening and carefully feel if you can find an object in or damage to the dosing openings or agitator.\nIf you see damage to the vanes, spreading disc or discharge bushing, the failure is most",
                    "page": 152,
                    "dataset": "table_questions",
                    "qa_error": false,
                    "self_evaluation": "no",
                    "eval_error": false
                }
            ],
            "duration_qa_seconds": 37.611928939819336,
            "total_questions_processed": 10,
            "duration_eval_seconds": 5.205686092376709
        }
    }
}